{
  "name": "public-v1",
  "version": "0",
  "description": "The default public disclosure profile: the public-v0 evidence set with masked publication of path-citing review results (ADR-0004). public-v0 is frozen for Bundles that pinned it; this revision is a new name per ADR-0006.",
  "required_evidence_kinds": [
    "plan",
    "goal_tracker",
    "state",
    "round_summary",
    "round_review_result"
  ],
  "omit_paths": [
    "round-*-prompt.md",
    "round-*-review-prompt.md",
    "*.jsonl",
    "*.log",
    ".loop/bitlesson.md",
    "methodology-analysis-report.md"
  ],
  "omit_kinds": [
    "prompt",
    "review_prompt",
    "transcript",
    "log",
    "bitlesson",
    "methodology_analysis_report"
  ],
  "field_redactions": [
    {
      "field": "commit.author_email",
      "reason": "Public profile privacy policy."
    }
  ],
  "secret_scan": {
    "fail_on": [
      "pem-header",
      "cloud-credential",
      "token-assignment",
      "high-entropy"
    ],
    "omit_on": [
      "absolute-path"
    ],
    "mask_on": [
      "absolute-path"
    ],
    "mask_kinds": [
      "round_review_result"
    ]
  },
  "max_bundle_bytes": 10485760,
  "max_item_bytes": 1048576,
  "require_reviewed_equals_head": true
}
